{"series_version":1,"id":"ramp.step","name":"tone_ramp.step","unit":"levels","frame":"cut:img-1:0000000000ab","frame_identity":"sha256:0000000000000000000000000000000000000000000000000000000000000008","channels":3,"rows":[0,1,2,3],"values":[1.5,1.2,0.9,1.4,1.1,0.8,1.3,1.0,0.7,1.2,0.9,0.6],"identity":"sha256:000000000000000000000000000000000000000000000000000000000000000d"}
